{
  "schemaVersion": "0.1",
  "id": "pixel-clock-mini",
  "slug": "pixel-clock-mini",
  "name": "Pixel Clock Mini",
  "description": "Đồng hồ pixel nhỏ gọn để bàn, hiển thị giờ và tạo điểm nhấn cho góc làm việc.",
  "price": 489000,
  "compareAtPrice": null,
  "images": ["/products/pixel-clock-mini.webp"],
  "tags": ["desk", "decor"],
  "active": true
}
